{
  "$schema": "https://json-schema.org/draft/2020-12/schema",
  "type": "object",
  "required": [
    "id",
    "name",
    "edition",
    "location",
    "dateFrom",
    "dateTo",
    "description",
    "website",
    "tickets"
  ],
  "properties": {
    "id": {
      "type": "string"
    },
    "name": {
      "type": "string"
    },
    "edition": {
      "type": "integer"
    },
    "location": {
      "type": "string"
    },
    "dateFrom": {
      "type": "string",
      "format": "date"
    },
    "dateTo": {
      "type": "string",
      "format": "date"
    },
    "description": {
      "type": "string"
    },
    "website": {
      "type": "string",
      "format": "uri"
    },
    "tickets": {
      "type": "array",
      "items": {
        "type": "object",
        "properties": {
          "id": {
            "type": "string"
          },
          "name": {
            "type": "string"
          },
          "description": {
            "type": "string"
          },
          "price": {
            "type": "number"
          },
          "currency": {
            "type": "string"
          }
        }
      }
    }
  }
}
