{
  "id": "prague-soundscapes-2026",
  "name": "Prague Soundscapes Festival",
  "edition": 1,
  "location": "Praha",
  "dateFrom": "2026-06-19",
  "dateTo": "2026-06-21",
  "description": "Prague Soundscapes Festival je třídenní multi-žánrový hudební a talk/workshop festival v Praze, zaměřený na elektroniku, alternativní pop, experimentální projekty a kreativní technologie.",
  "website": "https://example.com/prague-soundscapes",
  "tickets": [
    {
      "id": "full-pass",
      "name": "Full festival pass",
      "description": "Vstup na všechny dny a scény.",
      "price": 2490,
      "currency": "CZK"
    },
    {
      "id": "day-pass",
      "name": "Day pass",
      "description": "Vstup na vybraný festivalový den.",
      "price": 1190,
      "currency": "CZK"
    },
    {
      "id": "talks-pass",
      "name": "Talks & Workshops pass",
      "description": "Vstup pouze na denní talks a workshopy.",
      "price": 790,
      "currency": "CZK"
    }
  ]
}
